word,pos,definition
Homo,noun,"Homo is defined as being a human which is part of the genus Homo of hominids, or is offensive slang for a homosexual."
honour,noun,Honour is defined as great respect or privilege.
,verb,Honour is the British spelling for honor which is defined as to show respect for or give an award or title to.
hopefully,adverb,Hopefully is defined as in a positive or wishful way.
hot,adjective,The definition of hot is something that is very warm in temperature. It can also be used to refer to something that is currently very popular or trendy.
hour,noun,"The definition of an hour is sixty minutes, or a period of time."
house,noun,The definition of a house is a building or shelter where people or animals live.
,verb,House is defined as to provide someone or something with shelter or a place to live.
how,adverb,How is defined as in what way.
huh,interjection,"Huh is defined as something you say to ask a question, to indicate that you didn't hear, or to express surprise."
humour,noun,"Humour is the British spelling of the word humor, which is defined as the quality that makes people laugh."
hung,adjective,"The definition of hung refers to a jury that cannot agree on a verdict, to being delayed, or to having an emotional problem or block about something, or, in slang terms, hung also refers to a man with a large penis."
,verb,"Hung is defined as to have been suspended in the air or placed on a wall, or have done the act of suspending something in the air or placing it on the wall."
hypochondriac,noun,The definition of a hypochondriac is a person who always thinks something is wrong with him or who is abnormally worried about his health.
I,noun,I is the ninth letter in the English alphabet.
I,noun,I is defined as an incomplete grade for work in a class.
I,noun,The definition of i is the roman numeral for one.
,pronoun,I is defined as the person who is speaking or telling the story.
ibid,abbreviation,"Ibid, short for the Latin word ibidem, is defined as ""in the same place"" and is generally used in a footnote or reference citation to mean that the source is the same as the source referred to in the last footnote."
ID,abbreviation,ID is defined as an abbreviation for identification.
,contraction,I'd is defined as I had or I would.
,noun,"The definition of the id is the unconscious part of the mind that causes primal needs to be met, according to Freudian theory."
idea,noun,"The definition of an idea is a thought, belief, opinion or plan."
if,conjunction,"If is defined as in the event, or on the condition, that something happens."
illusive,adjective,The definition of illusive is dreamlike or not based in reality.
immensity,noun,The definition of immensity is the state of being huge or endless.
in,adjective,The definition of in is successful or powerful.
,adverb,In is defined as going from outside to inside.
,prefix,"In is defined as not, or into."
,preposition,"In is defined as inside the area, moving from a point outside to point inside or having a specific occupation or function."
inclined,noun,Inclined is defined as something that forms an angle due to its slope or tilt.
,verb,To be inclined means to tend towards something or to be likely to do a particular thing or choose a specific outcome.
including,verb,Including is defined as containing.
incognito,adjective,The definition of incognito is having a hidden identity.
index,noun,"The definition of an index is a guide, list or sign, or a number used to measure change."
,verb,"Index is defined as to categorize or list, or to make adjustments automatically based on a particular changing statistic."
Indian,adjective,"Indian is defined as something or someone relating to India or its people, or to Native Americans."
,noun,The definition of an Indian is a person born in India or a Native American.
indubitably,adverb,"The definition of indubitably is something so apparent, it's unquestionable."
ineligible,adjective,The definition of ineligible is someone who is disqualified from some particular thing or unable to be considered for something.
inextricable,adjective,The definition of inextricable is something that cannot be untied or something you are unable to escape from.
infidel,noun,The definition of an infidel is a person who you consider a heathen because he does not adhere to the religion you believe is the true religion.
inquest,noun,"The definition of an inquest is an investigation or inquiry into something, especially a court inquiry into the cause of death."
inquire,verb,"Inquire is defined as to look into something, to ask a question or to ask for information."
inquiry,noun,The definition of an inquiry is a question or an investigation.
inquisitive,adjective,"The definition of inquisitive is showing curiosity, or being eager to acquire information."
instead,adverb,Instead is defined as something chosen in place of or as a substitute for something else.
intended,adjective,"The definition of intended is something that has been planned, or is in the future."
,noun,Intented is defined as the person you have agreed to marry.
interesting,adjective,Interesting is defined as causing interest or holding attention.
Internet,noun,"Internet is defined as a connected group of computer networks allowing for electronic communication. The networks:Are comprised of educational, commercial and government sitesCan be made up of any number of computers from two to infinityInternet HistoryIt began in 1973 as a project proposed by the United States Department of Defense Advanced Research Projects Agency to link research facilities at defense agencies and universities within the United States.In 1983 the Internet was released to the world.The World Wide Web was designed by the European Center for Nuclear Research (CERN) in 1989 and allowed for all available published information to be searched and viewed in graphical mode.By 1996, there were more than 25 million computers online in over 180 countries.How It WorksThere is no central controlling computer or person that directs traffic or information.Users gain access through gateways.Information is sent/received by users based on their Internet addresses."
internship,noun,The definition of an internship is a period in which you work for free or little pay in order to learn a skill or get your foot in the door of an industry.
into,preposition,Into is defined as going from the outside to the inside.
inured,verb,"Inured is defined as caused someone to be less affected by pain, violence or other unpleasant things."
inversion,noun,Inversion is defined as being upside down.
is,verb,"The word ""is"" represents a singular form of the word be."
islam,noun,"Islam is the Muslim religion, the group of people who practice the Muslim religion, or the areas where the Muslim religion is the dominate religion practiced."
Israel,noun,Israel is a country between Jordan and the Mediterranean Sea.
Israel,noun,Israel are the Hebrew people descended from Jacob of the Bible.
it,pronoun,"The word ""it"" is used to represent an inanimate thing."
Italian,adjective,The definition of Italian is relating to Italy.
,noun,"Italian is defined as a person from Italy, or the culture or language of Italy."
Italic,adjective,"The definition of italic is a type style where the letters are slanted upward to the right, or something that relates to ancient Italy."
,noun,"Italic is defined as a printed letter that is slanted upward to the right, or a language of the Indo-European language family."
its,pronoun,"Its is defined as the possessive form of it, meaning the thing that belongs to “it.”"
ity,suffix,Ity is defined as the state of being something.
Japan,noun,Japan is defined as an Asian island country located off the Eastern coast of Asia.
Japan,noun,Japan means a hard smooth and glossy black coating.
,verb,"The definition of japan is to add a dark, smooth and hard gloss to a metal object."
Jesus,noun,"Jesus was a teacher and the founder of the Christian religion, or a male name."
jew,noun,The definition of a Jew is a person who belongs to a religion called Judaism and who generally traces his or her ancestry back to the ancient Hebrew people of Israel.
jewellery,noun,Jewellery is defined as the British spelling for fashion accessories made of gems and precious metals.
Judaism,noun,Judaism is defined as the Jewish religion and Jewish way of life.
judgement,noun,"Judgement, an alternative spelling for judgment, is defined as an opinion or a decision given by a legal court."
jumper,noun,"Ajumper is defined as a full-body item of children's clothing that goes over a shirt, or a British word for a sweater or pullover."
jumper,noun,The definition of a jumper is a wire used to make an electrical connection.
jumper,noun,Jumper means someone or something that jumps.
June,noun,June is the sixth month of the year after May and before July.
junket,noun,The definition of junket is an enjoyable trip or tour by a business person or public official that is paid for by their employer or from public funds.
junket,noun,The definition of junket is a pudding made from sweet milk and rennet.
Jupiter,noun,"The definition of Jupiter is the largest planet in our solar system, or the supreme god in Roman mythology.Facts About JupiterJupiter was named for the Roman king of the gods.Jupiter is the the fifth planet in the solar system and the largest of all the known planets, more than eleven times bigger that Earth.Jupiter contains both atmospheric gases and gases underneath the surface of the planet:Atmospheric Gases - Ammonia and Ammonium HydrosulfideGases Underneath the Surface - Helium, Methane, Hydrogen and Ammonium HydrosulfideIt is believed to have a small, rocky core.Jupiter has four faint dust rings which were detected in 1979.It is noted for it’s colorful striations of red, white, yellow, and brown. The light colored areas are called bands while the darker colored areas are called belts.Jupiter has the strongest magnetic field of all of the planets in the solar system.There are very strong electrical currents running through this planet.Jupiter generates its own heat.It has clouds of ammonia crystals. The temperature in the cloud tops of Jupiter is 230 degrees Fahrenheit.Jupiter is five times farther away from the Sun than the Earth. Its average distance from the sun is 483,780,000 miles.Jupiter spins faster than any other planet in our solar system which causes it to bulge in the middle and flatten at the poles. Jupiter rotates in approximately 10 hours.Jupiter has an elliptical orbit around the sun. One orbit is almost 12 Earth years long. It takes Jupiter 12 Earth years to orbit once around the sun.Jupiter’s most noticeable feature is called the Great Red Spot. It is an enormous, violent storm, similar to a hurricane on Earth and measures approximately the same diameter as Earth. Scientists are not completely sure what causes the Great Red Spot.To date, Jupiter has 63 known moons and confirmed satellites, the most of any planet. The moons were only discovered after 1975.Galileo’s observation of Jupiter’s moons was the first known recording of them, and Galileo was the first individual to observe Jupiter using a telescope.Seven different probes have been sent to learn more about Jupiter. The first was Pioneer 10 which did a fly by of Jupiter in 1973. In 1979, Voyager 1 and Voyager 2 discovered Jupiter's rings. The Galileo orbitor, launched in 1989, reached orbit by 1995 and collected data for over seven years until 2003 when it was intentionally crashed into the planet."
just,adjective,The definition of just is fair or right.
,adverb,Just is defined as right before or merely.
keep,verb,"Keep is defined as to hold, or retain something, or it can mean to continue doing something."
kilometer,noun,"The definition of a kilometer is a unit of measurement equal to 1,000 meters or .6214 miles."
kleptomaniac,noun,The definition of a kleptomaniac is someone with an abnormal urge to steal.
labour,noun,"Labour is the British spelling of the world labor, which is defined as work."
laid,verb,The definition of laid is the past form of lay.
lain,verb,Lain is defined as to have gone into a resting position.
large,adjective,"The definition of large is greater than average in size or amount, or important or significant."
last,adjective,"The definition of last is coming after all others, the most recent, the only remaining or the final."
,adverb,Last means after all others.
,noun,Last is defined as a person or thing that happens after everyone or everything else.
,verb,Last is to go on or continue for awhile.
late,adjective,The definition of late is something that happens or someone that arrives after the expected time.
later,adverb,The definition of later is afterward.
,interjection,Later is defined as an informal way of saying bye.
Latin,adjective,"The definition of Latin is something related to the language of ancient Rome, or someone or something associated with Latin America, its music or its language."
,noun,"Latin is the language of ancient Rome and is a language widely used in religion and scholarly works, or a person whose native language originates from Latin."
learn,verb,The definition of learn is to acquire knowledge or new information.
least,adjective,The definition of least is the lowest in importance or the smallest of something.
leave,noun,"Leave is defined as permission, or is time off from work."
,verb,"The definition of leave is to depart, or to let something alone, or to bequeath."
leaves,noun,The definition of leaves are parts of a plant or tree attached to the branches or stems.
,verb,Leaves is defined as exits.
lechery,noun,Lechery is defined as excessive or unrestrained indulgence in sexual activity or inappropriate sexual desires.
LED,verb,Led is the past tense of lead.
left,adjective,The definition of left is a person on the liberal side of politics or on the opposite side from the right side.
,verb,Left is defined as something remaining or to have gone away.
leftover,noun,The definition of leftover is something that remains after an initial serving or after initial selections have been made.
Lent,noun,"Lent is defined as a period of 40 days that Christians observe from Ash Wednesday to Easter, often marked by giving something up."
,verb,"The definition of lent is the past tense of lend, meaning to let someone have something temporarily."
lesbian,adjective,The definition of lesbian is something related to homosexual women or women who feel sexual attraction to other women.
,noun,"Lesbian is defined as a homosexual woman, or a woman who is sexually attracted to other women."
less,adjective,The definition of less is not as much.
,adverb,Less is defined as to a smaller degree or amount.
,noun,Less means a smaller amount or something not as important.
,preposition,Less is defined as minus.
light,adjective,"The definition of light is being pale, not deep or dark."
,noun,Light is defined as radiation that acts upon on the retina of the eye to make site possible.
,verb,Light means to make something burn or illuminate.
like,adjective,Like means similar or nearly the same.
,noun,The definition of a like is a preference or something that one enjoys.
,verb,Like is defined as to enjoy or agree with something.
like-minded,adjective,"The definition of like minded is having similar ideas, tastes, thoughts or opinions."
limbo,noun,The definition of limbo is a dance where you have to duck lower and lower to get underneath a pole without touching the pole or the ground.
limbo,noun,"Limbo is defined as a state where you uncertainly await something important, such as a decision about your future or, in some Christian religions, a place where babies go after they die if they have not been baptized."
,verb,To limbo means to do a dance where you have to duck and bend to get under a pole without touching the pole or the ground.
little,adjective,"The definition of little is small in size, quantity or importance."
,adverb,Little is defined as only slightly or not much.
live,adjective,"The definition of live is seeing or hearing a performance as it is happening, not prerecorded."
,verb,"Live is defined as to have life, continue to be alive, to reside somewhere or to behave throughout one's life in a particular way."
live-in,adjective,The definition of live in is someone who resides in your home with you permanently or on a full time basis.
logistic,adjective,The definition of logistic is something that relates to coordinating complex projects or movements or solving complicated problems.
logo,noun,The definition of a logo is a sign or symbol that identifies a company or a brand.
logo,noun,Logo is defined as a simple computer programming language for children.
long,adjective,The definition of long is an extended distance or an extended period of time.
loser,noun,"The definition of a loser is a person who is defeated or disadvantaged, is habitually failing or who is considered unpopular."
lost,adjective,The definition of lost is missing or unable to be found or it can mean something that was wasted or not used in a valuable way.
,verb,Lost is defined as the past tense of to lose.
lout,noun,The definition of a lout is a person without social manners.
low,adjective,"The definition of low is something with little height, emotionally depressed, below the surface level, quiet or deep in pitch."
Machiavellian,adjective,The definition of Machiavellian is related to the crafty and deceitful principles in Machiavelli's book The Prince.
,noun,Machiavellian is defined as a person who follows Machiavelli's ideas of deceitfulness in The Prince.
made-up,adjective,The definition of made up is a person who is wearing lots of cosmetics on his or her face.
made-up,adjective,Made up is defined as something that is not true or that is imaginary.
,verb,Made up means two people who had a fight have reconciled and gotten over it.
magnificence,noun,The definition of magnificence is splendor and lavishness.
make,noun,The definition of make is the style or way in which something is produced.
,verb,Make is defined as to produce something.
man,noun,The definition of a man is a member of the species Homo sapiens or an adult male.
mangrove,noun,"The definition of a mangrove is a tropical tree or shrub that grows in swampy areas and has tangled roots located above ground, or a tidal swamp with a number of these types of trees and shrubs."
manoeuvre,noun,"Manouevre is defined as the British spelling of maneuver, meaning a skillful move."
,verb,"Manouevre is the British spelling of maneuver, meaning to move in a skillful way."
manor,noun,"The definition of a manor is a mansion, or a house on an estate."
many,adjective,"The definition of many is an indefinite, large number of people or things."
Mars,noun,"The definition of Mars is the fourth planet from the sun.Facts About MarsThe Romans named Mars after their god of war but its nickname is the ""Red Planet,"" named because of its reddish color, caused by the iron oxide in the soil.In 1877 Giovanni Schiaparelli noticed a series of strange lines on the surface of the planet which he deemed canali, or canals. He supposed that these lines were waterways or highways built by alien people on Mars. H.G. Wells’ famous novel, The War of the Worlds, detailed an attack on the human race by Martians. In the 1960s the Mariner spacecraft confirmed that Mars was basically a lifeless planet; however, in 1996, scientists examined a meteorite that came from Mars and found microscopic life on it.Mars has a diameter of 4220 miles, a bit more than half the size of Earth.A day on Mars is approximately 24 hours and 39 ½ minutes. Mars orbits the Sun every 687 Earth days.It is a cold planet, reaching -207 degrees F. and rarely getting above freezing (32 degrees F.).The poles of Mars are covered in dry ice (carbon dioxide) and the amount of ice varies by season.Basalt makes up the outer surface of Mars, due to the volcanic activity in the past.The 900 mile diameter core of Mars is mostly solid, made of nickel, iron, and sulfur. The outer crust is basalt. The core produces a very weak magnetic field. There is evidence of water under the surface.Mars has the highest mountain in all of the solar system, Olympus Mons. It is an inactive volcano that is 15.5 miles high and 372 miles in diameter.Mars has the biggest canyon system in all of the solar system, the Valles Marineris, which is 2500 miles in length and is four miles deep.Mars has two small moons. Deimos orbits east to west, and Phobos orbits from west to east. They are not spherical and are most likely asteroids. The moons were discovered in 1877, by Asaph Hall, at the U.S. Naval Observatory."
martyrdom,noun,"The definition of martyrdom is the state of suffering, or giving one's life for a cause."
Marxism,noun,The definition of Marxism is the theory of Karl Marx which says that society's classes are the cause of struggle and that society should have no classes.
math,noun,"The definition of math is the overall group of sciences that study numbers, shapes and their relationships."
matter,noun,"The definition of matter is what something is made of, what all physical things are made of, or something important or a problem."
mausoleum,noun,The definition of a mausoleum is a very large tomb or room for burial.
may,verb,May is defined as possible or permissible.
mediation,noun,The definition of mediation is a process of negotiation in a relationship to resolve differences.
Medicare,noun,Medicare is defined as a federal health program that pays for some of the medical and hospital expenses of people over 65 years of age using Social Security funds.
mediterranean,adjective,"The definition of Mediterranean is something related to or characteristic of the Mediterranean Sea, the countries bordering the sea or its inhabitants."
,noun,Mediterranean is defined as the Mediterranean Sea or a native of a country bordering the Mediterranean Sea.
ment,suffix,"Ment is defined as a result, condition, process or is defined as of doing something."
merchandising,noun,The definition of merchandising is the act of promoting someone or something for sale in a retail store or retail setting.
Mercury,noun,"The definition of mercury is a heavy, silver-white metal with an atomic number of 80 that is liquid at ordinary temperatures.Facts About Mercury As a MetalIts symbol is Hg, from the Latin hydrargyrum, meaning liquid silver.Its boiling point is over 356 degrees Celsius, and it freezes at around minus 38 degrees Celsius.It does not conduct heat very well, but is a fairly good conductor of electricity.It has high surface tension and breaks up when poured or spilled onto a flat area, forming small beads which move around quickly.It is used in thermometers because its expansion when heated is fairly constant, and in barometers because of its density.It can be easily absorbed into your body through the skin, lungs, or by ingesting it.You should never knowingly inhale or ingest mercury. Its vapor can be poisonous in concentrated amounts. It can: Damage your nervous system, cause brain and kidney damage, inhibit your immune system and lead to birth defectsIt was also known as quicksilver, because of its appearance and it is liquid. It is the only metal which is liquid at room temperature.Mercury was known to ancient civilizations including the Egyptians and the Chinese. It has been found in Egyptian tombs dating back to the second century B.C. Some thought it could heal and promote good health and used it as medicine.Medieval alchemists thought that mercury became gold when it was in a solid state."
meridian,adjective,The definition of meridian is at midday or the greatest or highest point.
,noun,"A meridian is defined as a large imaginary circle that passes through two poles, particularly on a globe, or the highest stage of development."
Messiah,noun,The definition of a messiah is a savior or leader for some cause.
Met,verb,Met is defined as two or more people or things have come together or connected.
Mexico,noun,"Mexico is defined as a North American country south of the United States, with Spanish as its national language."
miasma,noun,The definition of miasma is steam rising from rotting vegetable or animal matter.
mice,noun,Mice are defined as little rodents.
mid,adjective,The definition of mid is something in the middle.
middle,adjective,The definition of middle is being at a central or intermediate point.
,noun,Middle is defined as the area that is at the center.
mincing,adjective,The definition of mincing is the actions of someone who acts dainty or refined.
mining,noun,"Mining is defined as extracting metals and minerals from the Earth, or the process of placing explosives where they will explode."
mm,abbreviation,Mm is defined as millimeter.
,interjection,Mm is defined as a way to say yes or maybe to a question.
modernity,noun,"Modernity is the state of being current, or up with the times."
mogul,noun,The definition of a mogul is a powerful or rich individual or a bump on a ski slope.
mom,noun,Mom is a person who has given birth to a child or who has responsibility for the care of children.
Mongolian,adjective,The definition of Mongolian is a person or thing from the country of Mongolia.
monologue,noun,The definition of a monologue is a part in a play in which a character speaks alone.
monologue,noun,The definition of a monologue is a speech presented by one person.
monotheism,noun,Monotheism is the belief in only one God.
more,adverb,"More is defined as something done again, or something that is done or felt to a larger extent."
,pronoun,More means a larger amount or greater number of things.
mortician,noun,The definition of a mortician is an undertaker - a person whose job it is to host funerals for the dead.
