word,pos,definition
,noun,Cold is defined as a contagious virus that causes you to have a stuffy nose and sometimes a sore throat and a fever.
collation,noun,The definition of collation is the act of assembling people or elements into an order for a specific purpose.
color,noun,The definition of color is a component of light which is separated when it is reflected off of an object.
,verb,"To color something is to add a hue, shade, paint or dye to an object or picture."
colour,noun,The definition of colour is the British word for color.
,verb,Colour is defined as the British spelling for color.
come,verb,The definition of come is to move closer to the requester.
come,verb,Come means to reach a particular state or action.
comeuppance,noun,The definition of comeuppance is getting the punishment you deserve.
coming,adjective,"The definition of coming is arriving or happening next, or having a lot of potential."
,noun,Coming means an arrival.
commemorative,adjective,The definition of commemorative is something intended to act as a memorial or as an official expression of honoring a person or an event.
,noun,A commemorative is defined as a coin or other object that is made with the intent to honor or memorialize a person or an event.
company,noun,The definition of company is a guest or a group of people associated with each other.
con,noun,"The definition of a con is a disadvantage, a negative reason or a scam designed to trick or defraud someone."
,verb,"To con is to trick someone, or use deception to defraud or lie to someone."
confused,adjective,"The definition of confused is a person who cannot think clearly, or is something that is jumbled or without order."
,verb,Confused means you caused someone to feel bewildered or perplexed.
conjugal,adjective,The definition of conjugal is relating to marriage or a relationship.
contagion,noun,"The definition of contagion is an infectious disease spread through contact, or the transmission of a disease from one person to another through contact, or the spread of a bad or harmful idea or practice."
contextual,adjective,"The definition of contextual is depending on the context, or surrounding words, phrases, and paragraphs, of the writing."
contraband,adjective,The definition of contraband is not allowed to be imported or exported.
,noun,"Contraband is defined as goods that are against the law to trade or to be imported or exported, or goods that are smuggled or a slave during the Civil War who was behind the Union lines."
conveyance,noun,The definition of conveyance is the act of transmitting or transferring something.
coordinator,noun,The definition of a coordinator is a person who is in charge of planning something or of facilitating the occurrence of events or the collaboration of people.
cordial,adjective,The definition of cordial is someone who is nice and friendly.
cordiality,noun,The definition of cordiality is sincere kindness.
corps,noun,The definition of a corps is a group of people working together or under the same organization to achieve a common goal or goals.
corps,noun,Corps is defined as a special branch of the military or a group of combat forces consisting of two or more divisions and assisting troops.
cost,noun,The definition of cost is the amount paid for something or the expense of doing something.
,verb,Cost is defined as to be priced at something or to lose.
could,verb,"The definition of could is often used in the place of ""can"" to show a little doubt."
counseling,noun,The definition of counseling refers to guidance or advice provided to help someone resolve difficulties or decide issues.
country,adjective,The definition of country is relating to rural life.
,noun,"A country is defined as a nation, the people of the nation or land in a rural area."
cover,noun,"The definition of a cover is something that goes over, rests on the surface or provides a place to hide."
,verb,Cover is defined as to conceal or place something over.
cowardly,adjective,The definition of cowardly is something characterized by a lack of courage.
crackdown,noun,The definition of crackdown is the strict enforcement of specific rules.
criteria,noun,"Criteria is defined as the plural form of criterion, the standard by which something is judged or assessed."
crone,noun,"The definition of a crone is a hag or an old, ugly woman."
culvert,noun,The definition of culvert is a tunnel or a drain under a road or a railway that carries a stream or drainage from one side to the other.
,verb,Culvert is defined as to channel or direct a stream or drainage through a tunnel under a road or railway.
cut,adjective,The definition of cut is having been divided by a sharp object or having been reduced.
,noun,Cut is defined as the act or result of removing or dividing with a sharp object.
,verb,Cut means to divide with a sharp instrument.
dad,noun,Dad is defined as a term used for your father.
daddy,noun,Daddy is defined as an affectionate name for a father.
daisy,noun,"The definition of a daisy is a type of flower with white petals around a yellow center, or a female name, or is slang for something very good."
datum,noun,The definition of a datum is a fact used to make a conclusion or a point of reference in geography or geology.
daub,noun,The definition of a daub is something covered in stickiness or greasiness.
,verb,Daub is defined as covering or smearing with paint or something sticky or grease.
day,noun,The definition of a day is a 24-hour period of time or the period of light between sunrise and sunset.
declarative,adjective,The definition of declarative is a simple or definitive statement.
,noun,"Declarative is defined as a definitive statement, simple word or phrase."
defecate,verb,To defecate is defined as to have a bowel movement.
defence,noun,"Defence, the British spelling of defense, is defined as a protection against attack or the act of guarding, or an action that is taken in response to an attack."
delighted,adjective,The definition of delighted is you feel great pleasure or joy.
demeanour,noun,"Demeanour is defined as an alternative spelling of demeanor, which refers to your general personality and the way you behave."
deprived,adjective,The definition of deprived is not having enough of the necessities of life or a lack of positive opportunities and experiences.
describe,verb,Describe is defined as to give details about something to someone.
dialogue,noun,"The definition of dialogue is conversation, or an exchange of ideas."
did,verb,Did is the past tense of do.
difficult,adjective,The definition of difficult is something that is hard to understand or do and is a person that is hard to get along with.
dimensional,adjective,The definition of dimensional is something a shape that can be measured.
dirty,adjective,"The definition of dirty is something soiled, unclean or impure."
,verb,To dirty is to cause something to become unclean or impure.
disburse,verb,Disburse is defined as to pay or give out.
distressful,adjective,"The definition of distressful is something that causes pain, unhappiness, anxiety or fear."
dna,abbreviation,"DNA, which stands for deoxyribonucleic acid, is defined as a nucleic acid that contains the genetic code.Facts About DNAIt is a long polymer that is composed of repeating nucleotides.The largest DNA polymer that is known is about two hundred and twenty million base pairs long.In 1869, the physician Friedrich Miescher first isolated DNA. While examining the substance of pus in surgical bandages, he observed a microscopic substance in the pus. He named it nuclein because he observed it in the nuclei of cells.In 1928, Frederick Griffith realized that DNA might actually hold genetic information. In 1952, Alfred Hershey and Martha Chase performed an experiment which confirmed that DNA had a role in heredity.In 1953, James D. Watson and Francis Crick proposed the idea that the DNA’s structure was a double-helix.It was not until scientists used x-ray technology that they were to finally able to see the structure of a DNA molecule. In 1953 Rosalind Franklin was the first to take the most accurate picture, which became known as photograph 51, that truly defined the structure of the double helix shape of DNA.In 1962, the Nobel Peace Prize was given to James Watson, Francis Crick, and Maurice Wilkins (an associate of Franklin who had died by 1962.)."
do,verb,Do is defined as to accomplish an action.
downside,noun,The downside is defined as the negative aspects or the disadvantages of something.
dramatically,adverb,Dramatically is defined as something done with great flare or done in an overly exaggerated or theatrical manner.
drawn,adjective,The definition of drawn is looking very tired or sick.
,verb,Drawn is defined as to have created and illustrated.
driven,adjective,"The definition of driven is a goal-oriented person, something that's been moved and piled by the wind, or something caused or operated."
,verb,"Driven is the past form of drive, which is defined as to move something using force."
dross,noun,Dross is defined as worthless waste matter.
dug,verb,Dug is defined as uncovered or removed.
during,preposition,During is defined as at the same time or through the entire time.
DVD,noun,"The definition of a DVD, which stands for digital video disc, is an optical disc that can store large quantities of digital material such as sound, images and data."
dying,verb,"Dying is defined as waning or about to disappear, or just about to pass away.Facts About DyingWhen someone is near death their mind and physical body begins to start shutting down each system. The changes in each bodily system are very gradual and can build up over time.The person may not wake easily.The body begins to process food at a slower rate, so constipation is a very common side effect of the process – as is losing control of bowel movements and urination.The body begins to slow down the circulation of blood throughout the body, which means that the hands and feet of the person get very cold and numb.The breathing cycle might also change, with longer periods of time between breathes and more shallow breathing.The person might become disoriented really easily, losing their way, becoming dizzy, and getting confused.A person may become moody or withdrawn.Hearing is one of the last senses to be lost and may be present until the end of the person’s life."
early,adjective,"The definition of early is near the beginning, or belonging to a previous time."
,adverb,"Early is defined as before the expected time, or soon after the start."
Easter,noun,"Easter is defined as the Sunday each year that celebrates the resurrection of Jesus with special church services and meals as well as a more secular celebration with Easter baskets filled with candy, delivered by an Easter bunny."
easy,adjective,"The definition of easy is something that can be done with ease, is not hurried, is not difficult, is free from anxiety or is comfortable."
eat,verb,"To eat is defined as to put food in the mouth, chew and swallow or to use up."
effectual,adjective,"The definition of effectual is someone or something that is doing what it was intended to do, or has legal force."
egg,noun,The definition of an egg is the female reproductive cell in many animals or the thin-shelled oval body laid by hens and other animals.
Egypt,noun,Egypt is defined as a country in northeastern Africa.
Egyptian,adjective,Egyptian is defined as something related to the culture and people of Egypt.
either,adjective,The definition of either is one or the other.
,pronoun,Either is defined as one or the other.
embellishment,noun,"Embellish is defined as fancy details added on to make something look better or nicer, the act of adding such details or the act of stretching the truth of a story to make it sound more exciting."
emigration,noun,Emigration is defined as the act of leaving one's country to live in another.
emulation,noun,Emulation is defined as the act of trying to match or equal someone.
encouraging,adjective,The definition of encouraging is something that gives hope.
end,noun,"The definition of an end is the last part, or limit of something."
endearment,noun,"Endearment is defined as affection, or to words used to express affection."
endeavour,noun,"Endeavour is defined as an alternate spelling of endeavor, which is defined as something you try or attempt with a lot of effort."
engaging,adjective,The definition of engaging is something interesting or fascinating.
English,adjective,The definition of English is someone or something that is from England.
English,adjective,English means the language of the United States and England.
,noun,English is defined as the language spoken by people of England and the United States.
enough,adjective,The definition of enough is something that is just what you need and nothing more.
,adverb,Enough is defined as having done something adequately or sufficiently.
,noun,Enough means as many as you need or are allowed.
eternity,noun,"Eternity is defined as, or seems like, an endless amount of time."
evaporation,noun,Evaporation is defined as the process of a liquid changing into a gas.
even,adjective,The definition of even is level or fair or divisible by two.
,verb,To even something is defined as to make it equal or to make it level or smooth.
even-tempered,adjective,"The definition of even tempered is someone who is not quickly angered or prone to mood swings or wild emotion; but, who instead remains calm."
except,conjunction,"Except is defined as something said when one action depends on another action, or to show a variation in action."
,verb,To except is defined as to leave out or take out one when you include everything else.
exchequer,noun,Exchequer is defined as a royal or national treasury or is defined as the account into which tax funds and other public funds are deposited.
excited,adjective,The definition of excited is someone or something that has enthusiasm or is emotionally aroused.
,verb,"Excited is defined as making someone feel emotions, or having an increased activity level."
exclamatory,adjective,The definition of exclamatory is a cry or remark that is sudden or strong and expresses an emotion.
exemption,noun,"Exemption is defined as freedom from an obligation, duty or consequence."
extended,adjective,The definition of extended is longer or more than the usual.
eye,noun,"The definition of an eye is the organ that gives sight in humans and animals, or the iris."
,verb,To eye is defined as to look at or observe.
façade,noun,The definition of a facade is the front of a building facing a public space or an artificial front or appearance by someone.
fact,noun,The definition of a fact is something that is true or something that has occurred or has been proven correct.
Fahrenheit,adjective,The definition of Fahrenheit is a temperature scale with 32 degrees as the freezing point of water and 212 degrees as the boiling point of water.
fall,noun,The definition of a fall is an often unexpected drop or descent or the season that comes after summer and before winter.
,verb,"Fall is defined as to drop or come down, often unexpectedly."
family,noun,"Family is defined as a specific group of people that may be made up of partners, children, parents, aunts, uncles, cousins and grandparents."
family,noun,The definition of family is the group of people who share common ancestors.
family,noun,Family means a group of things that are similar.
fanfare,noun,"Fanfare is defined as a loud and flashy display, or a short and dramatic trumpet flourish."
farther,adjective,The definition of farther is something described as having a greater physical distance. The distance would have been measured.
,adverb,"Farther is defined as a greater physical distance, a distance that has been measured."
farthest,adjective,"The definition of farthest is something that is a longer, measurable physical distance."
favorite,noun,The definition of a favorite is a person or thing that is best liked or treated in a special way.
favour,noun,The definition of favour is approval or doing something for someone else.
,verb,Favour is defined as to treat with an unfair preference.
feasibility,noun,Feasibility is defined as the state of something being possible or suitable.
February,noun,February means the second month of the year.
fed,abbreviation,Fed is a shortened form of Federal and is defined as a U.S. federal agent.
,verb,Fed is defined as to have given someone food in the past.
feet,noun,Feet is defined as the part of the body that touches the ground or multiples of 12 inches.
few,adjective,The definition of few is a small number of something.
,pronoun,Few is defined as not many.
fiat,noun,"The definition of a fiat is an order or decree, or any arbitrary order."
find,noun,"The definition of a find is something discovered, particularly something of worth and value."
,verb,Find is defined as to come across something by chance or to locate something that was once lost.
first-class,adjective,The definition of first-class is of the highest or best.
,adverb,First-class is defined as done in the most lavish or stylish way.
fled,verb,"Fled is defined as that you ran away from something, especially something dangerous or undesirable."
flown,verb,"Flown is the past tense of fly, which is defined as when a person or thing moves through the air."
follow-up,noun,The definition of a follow-up is a return to an existing situation or to a situation that is underway in order to determine what the current status is and whether all has been done or is being done.
food,noun,The definition of food is nourishment taken into the body.
football,noun,"The definition of football is a game played on a 100-yard field with two teams of 11 players and one goal at each end, or the actual ball for such a game, or an issue that is passed around."
for,preposition,"For is defined as the purpose, destination, recipient or amount of something."
forthcoming,adjective,"The definition of forthcoming refers to something that is about to happen, or to someone who is willing to openly share information."
fortieth,adjective,"The definition of fortieth is something that occurs after 39 other things have occurred, or that occurs in the position identified by the number 40."
fought,verb,"Fought is defined as to have participated in a verbal or physical disagreement, or to have overcome something."
four,noun,Four is a number that comes after 3 and before 5.
French,adjective,The definition of French is someone or something associated with the country of France.
,noun,French is the language spoken in France.
,verb,French is defined as cutting food into thin strips or trimming all the meat and fat from the bone of a meat chop.
Friday,noun,"Friday is defined as the day before the weekend, or the sixth day of the week."
from,preposition,"From is defined as a starting point, removal or separation."
fuck,interjection,Fuck is defined as an offensive curse word used to express anger.
,verb,Fuck is an offensive curse word that is defined as to meddle with or to have sexual intercourse.
fundamentalism,noun,"Fundamentalism is defined as strict adherence to some belief or ideology, especially in a religious context, or a form of Christianity where the Bible is taken literally and obeyed in full."
furthest,adjective,The definition of furthest is something that has a greater distance or degree than others.
German,adjective,The definition of German is relating to the culture of Germany.
,noun,"The definition of a German is a person from Germany, a person who has ancestors from Germany, or any of the West Germanic languages."
get,verb,Get is defined as to receive.
give,verb,"Give is defined as to hand, present or place."
glass,adjective,"The definition of glass is something made of or like the hard substance made of silicates, soda or potash, lime and sometimes metallic oxides."
,noun,"Glass is defined as a hard substance made by heating and then quickly cooling sicilates with soda or potash or lime, or something made of this substance."
,verb,"Glass means to put food into canning jars, to reflect or to replace broken windows."
go,verb,Go is defined as to move or leave.
going,adjective,"Going is defined as something that is successful, in existence or commonly accepted."
,noun,The definition of a going is a departure or forward progress.
gone,adjective,"The definition of gone is something that has left, departed or that is no longer there."
good,adjective,"The definition of good is someone or something that is efficient, useful, healthy, strong, happy or skilled."
goodbye,interjection,Goodbye is defined as a way to express that you are leaving.
gore,noun,The definition of gore is violence and bloodshed.
,verb,To gore is defined as the action of an animal stabbing someone or another animal with a horn.
gory,adjective,The definition of gory is something covered in blood or related to bloodshed.
got,verb,Got is defined as to have received or bought something.
Greek,noun,"The definition of Greek is a person born in Greece, a person who's ancestors were from Greece or the language spoken by people from Greece."
grouse,noun,"The definition of a grouse is a complaint, or a type of game bird with a chubby body, feathers on its nose and different colored feathers."
,verb,Grouse is defined as to complain.
grow,verb,The definition of grow is to become or cause something to become larger in size or to undergo the natural process of developing.
grueling,adjective,"The definition of grueling is something exhausting, challenging or demanding."
guy,noun,The definition of a guy is a statue of Guy Fawkes that is displayed and burned on Guy Fawkes Night in England.
guy,noun,"Guy is defined as a rope, chain or cable used for to support, secure or direct something, or is an informal term for a man or boy."
gypsy,noun,The definition of a gypsy is a member of a tribe of people found throughout the world who has no permanent home or someone who shares this wandering lifestyle.
had,verb,"Had is defined as to have contained, held or owned something in the past."
Halloween,noun,"The definition of Halloween is a holiday celebrated in the U.S., Canada and the British Isles on October 31st where people dress in costumes and children go door to door asking for candy."
hand,noun,The definition of a hand is the part of the human body at the end of the arm.
hand,noun,Hand means applause.
,verb,"To hand is defined as to transfer, deliver or give."
hap,noun,The definition of a hap is something happening or that happens by chance.
happen,verb,Happen is defined as to take place or occur by chance.
harbour,noun,"The definition of a harbour is a place providing safety or shelter, or a protected area in the water for anchoring boats."
,verb,"Harbour, a British spelling for harbor, is defined as to hide, protect or hold on to."
has,verb,Has is defined as to possess or own something.
hate,noun,The definition of hate is a feeling of intense dislike or aversion.
,verb,To hate is defined as to feel strong and intense aversion or dislike.
have,verb,"Have is defined as to contain, hold or own something."
hazy,adjective,"The definition of hazy is something that is clouded over or covered by mist or haze, or something that is unclear, vague or not well-defined."
heavy,adjective,"The definition of heavy is of great weight, amount, force, quantity or size."
,noun,Heavy is defined as a somber role or the role of a villain in theatre or is slang for an influential person.
held,verb,The definition of held is the past tense of hold.
hello,interjection,"Hello is defined as a greeting or a response when on the phone, used to bring attention or an expression of surprise."
help,interjection,Help is defined as a plea or request for aid or assistance.
,noun,"The definition of help is aid that you request, or is someone who provides assistance."
,verb,"Help means to provide aid or assistance, or to improve a situation."
hemorrhage,noun,"The definition of a hemorrhage is a rapid loss of blood, usually due to a ruptured blood vessel, or a rapid loss of resources or valuable people."
,verb,"Hemorrhage is defined as to lose large amounts of blood rapidly, or to spend large sums of money rapidly or without control."
her,adjective,The definition of her is the possessive form of she.
,pronoun,Her is defined as she or a female.
heterosexual,adjective,The definition of a heterosexual is someone who is sexually attracted to a person of the opposite sex.
hey,interjection,"Hey is defined as an expression of greeting similar to ""hello,"" or is a way to attract attention or express annoyance."
hi,interjection,"Hi is defined as a standard greeting and is short for ""hello."""
hidden,adjective,The definition of hidden is concealed.
high,adjective,"High is defined as something that is further up than normal, goes upward, is far above the ground, or is slang for being under the influence of drugs."
Hindi,adjective,The definition of Hindi is related to North Indian or the Hindu religion.
,noun,Hindi is defined as the major language in India.
his,adjective,The definition of his is belonging to or done by him.
,pronoun,His is defined as the possessive form of he.
hispanic,adjective,The definition of Hispanic is relating to Spanish-speaking culture or people.
,noun,"Hispanic is defined as a Spanish-speaking person who lives in the U.S. and comes from Portugal, Spain or Latin America, or someone of this descent."
home,adjective,The definition of home is something that relates to or happens inside the place where a person or family resides.
,noun,Home is defined as a house or place where a person or family lives or where someone was born.
