word,pos,definition
able,adjective,The definition of able is to have the skills or strength to do a task.
about,adjective,About means moving around.
 ,adverb,About means almost.
 ,preposition,About is defined as something close or approximate.
 ,preposition,The definition of about is being in reference to or concerning something.
accepted,adjective,The definition of accepted is approved or considered normal or usual.
 ,verb,Accepted means an object or idea that was approved of in the past.
acclaim,verb,To acclaim would be to strongly praise or applaud.
accustomed,adjective,The definition of accustomed is that something has become normal or typical for you or something which is customary or usual.
across,adverb,The definition of across is on the other side or from the other side.
 ,preposition,Across is defined as from one side to the other.
act,noun,An act is defined as an action or something which is done.
 ,verb,The definition of act means to do something.
addle,adjective,Addle is defined as something that becomes spoiled.
addle,adjective,Addle means someone who is confused or not thinking right
 ,verb,The definition of addle refers to causing someone to become confused or to becoming unable to think clearly.
adjutant,noun,"The definition of an adjutant in the U.S. military is a staff officer, while in the British military he is an executive officer."
aesthetic,adjective,The definition of aesthetic is being interested in how something looks and feels.
aesthetic,adjective,"Aesthetic means the pleasant, positive or artful appearance of a person or a thing."
 ,noun,"Aesthetic is defined as a concept of what is visually acceptable, in trend or expected at the time."
affixation,noun,The definition of an affixation is the act of adding something to something else.
again,adverb,Again is defined as returning to a place.
again,adverb,Again means something that is repeated.
age,noun,Age is defined as a span of years during which some event occurred.
age,noun,The definition of age is the number of years something has been alive or in existence.
 ,verb,Age means to experience the passage of time or show signs of growing older.
agglomeration,noun,"The definition of an agglomeration is a mass of varied parts, or the act of amassing various parts."
aging,verb,"The definition of aging refers to the process of getting older, or an artificial process to make someone or something look older."
ago,adjective,The definition of ago is before now or in the past.
 ,adverb,Ago is defined as in the past or before.
AIDS,abbreviation,"AIDS is defined as an abbreviation for for Acquired Immune Deficiency Syndrome and is caused by the HIV virus.Facts About AIDS and HIVHIV stands for Human Immunodeficiency Virus, a virus that can be contracted in a small number of ways.Once someone contracts the HIV virus from an infected person, the viral cells attach to CD4 lymphocyte helper cells within the body. Typically these types of cells are used to combat common infections within the human body; they are an essential part of the immune system.The viral cells continue to attach themselves to the CD4 cells and then multiply to destroy them; eventually those affected with HIV become unable to combat both common and uncommon infections.When this happens the patient is said to have full blown AIDS.AIDS is also diagnosed when amount of CD4 helpers left in the body drops below a certain required amount.The first cases of HIV were reported in the United States in 1981 in the cities of San Francisco and New York. Today those affected by the HIV virus can be found throughout the United States and the world.According to the World Health Organization (WHO), there were 33.3 million people living in the world with HIV as of 2010.As of 2010, over 22 million of the 33.3 million adults and children with HIV lived in African countries where the economy allows limited access to the medications needed to treat and suppress the disease. The lowest number of cases is found in North Africa, with the Sudan showing the highest HIV concentration in that region.By the end of 2008, two million people had died of AIDS with 1.9 million of these people living in Africa."
all,adjective,The definition of all is the entire amount.
allied,adjective,Allied is defined as two or more things that are similar or related to each other.
allied,adjective,"The definition of allied is two or more individuals, organizations, or countries who are working together toward the same purpose as a result of a mutual agreement."
along,adverb,Along is length or placement.
 ,preposition,"Along is defined as to be next to, or to abut something."
 ,preposition,The definition of along is something that happens during an activity.
 ,preposition,Along is adhere or stand by.
 ,verb,"Along, when prefaced by the word “get,” is defined as to be pleasant with someone else."
already,adverb,Already is defined as something that happened before a specific time.
always,adverb,Always means lasting and unending.
always,adverb,Always is defined as doing something regularly.
am,abbreviation,"The definition of am means ante meridiem in Latin, which means before 12 noon."
 ,verb,The definition of am is a verb that is used with the word I as the first person singular version of the verb be.
Amazon,noun,"In mythology, an Amazon was defined as a female in battle known to live in Pontus, close to the Black Sea."
Amazon,noun,The definition of an amazon is a woman possessing extraordinary height and strength.
Amazon,noun,"The Amazon, in South America, is the largest river in the world."
ambrosia,noun,The definition of ambrosia is a sweet fruit dessert salad that has a thick custard-like consistency.
ambrosia,noun,"In mythology, ambrosia is defined as the food or drink of the Greek Gods."
ambrosia,noun,Ambrosia is defined as any food or aroma that is remarkably pleasant to taste or smell.
America,noun,The definition of America is the term most often used to refer to the United States.
American,adjective,American describes a person or thing from the United States of America.
American,adjective,"The definition of American refers to any person or thing related to, or aboriginal to, North or South America."
 ,noun,The definition of an American is someone who is a natural born or naturalized citizen of the United States.
 ,noun,An American is defined as someone who lives in North or South America.
among,preposition,"The definition of among is being in a group things, usually more than two, or being part of a group."
an,adjective,The definition of an is a word used in place of the word “a” when the following word begins with a vowel sound.
analogue,noun,The definition of an analogue is a thing or person that is like something else in some ways.
analyse,verb,"The definition of analyse, commonly spelled analyze, means to learn about something by looking closely at its individual parts and determining how they work together."
and,conjunction,"And is used to express also, in addition, moreover, then, besides, at the same time and plus."
annotation,noun,The definition of an annotation is an added note that explains something in a text.
anoint,verb,The definition of anoint means to smear or rub with oil.
another,adjective,Another is defined as an additional amount.
another,adjective,Another means someone or something that is not the same.
another,adjective,Another refers to someone of something that is comparable or alike.
 ,pronoun,"The definition of another is one more of a person, place or thing."
 ,pronoun,Another refers to something that is dissimilar.
 ,pronoun,Another can refer to doubling something.
answer,noun,The definition of an answer is a response to a question or inquiry that can be given orally or in written form.
answer,noun,An answer is defined as something that is similar or a close copy.
 ,verb,"To answer is defined as to give a response to a question in either an oral or written manner, or by a physical gesture."
 ,verb,Answer means to deal with a result of something.
Antarctic,adjective,The definition of Antarctic is anything that is closely located or related to the South Pole.
any,adjective,"The definition of any is a quantity, and can be used in place of some or one."
any,adjective,Any refers to a selection of several things.
 ,adverb,Any is defined as an amount or degree.
 ,pronoun,Any can be used to refer in vague terms to a person or people.
app,noun,The definition of an app is short for application and is software for use on a smart phone or computer.
appal,verb,The definition of appal means to shock or amaze in a negative way.
archaeologist,noun,"The definition of an archaeologist is a person who studies human history, particularly the culture of historic and prehistoric people, through discovery and exploration of remains, structures and writings."
archaeology,noun,"The definition of archaeology is the study of human history, particularly the culture of historic and prehistoric people through the discovery and exploration of remains, structures and writings."
Arctic,adjective,"Arctic is defined as a way to describe something very cold, like freezing icy temperatures or a person’s disinterested or chilly attitude."
Arctic,adjective,The definition of Arctic is a name for anything associated with the North Pole region.
 ,noun,An Arctic means a waterproof shoe that is worn over a regular shoe.
are,verb,"The definition of are is a plural, present tense conjugation of the verb be."
arose,verb,"The definition of arose is for something to come up or originate, or for someone to stand up."
ashen,adjective,The definition of ashen is being gray or ash colored.
ask,verb,"To ask is to inquire about something in order to get an answer, response or action."
aspiring,adjective,"The definition of aspiring is looking forward to something with great desire, hoping for some dream or goal to come true, or working towards making something happen."
assuming,verb,The definition of assuming is the action of formulating or verbalizing an idea for which there is no evidence.
assuming,verb,Assuming is defined as taking on responsibility or fulfilling the obligations of someone else's position by taking over his job.
assuming,verb,Assuming means fulfilling the obligations of someone else's position by taking over his job.
at,preposition,"The definition of at is to show position, to show something that an action refers to, or to show a condition or something that is happening."
atavism,noun,The definition of an atavism is a genetic trait that reoccurs after skipping several generations.
ate,suffix,"The definition of ate as a suffix is to indicate the salt of an acid, or is used to show offices, functions, institutions or leaders."
 ,verb,The definition of ate is to have eaten.
August,noun,The definition of August is a month on the Gregorian calendar that is 31 days in length which comes after July and before September.
Australia,noun,"The definition of Australia is the name of one of the seven continents of the world and includes the countries of Australia, New Guinea, the Aru Islands, and the Raja Ampat Islands."
automaton,noun,The definition of an automaton is a self-propelled or self-powered machine.
baby,noun,The definition of a baby is an extremely young child or animal.
back,adjective,The definition of back is in the rear.
 ,noun,Back means the rear of something.
 ,verb,Back is defined as to support or to move in a backward motion.
bandy,verb,The definition of bandy means to throw something or an idea like a ball back and forth.
bank,noun,Bank is defined as a long pile or mound.
bank,noun,"The definition of a bank is a place that receives, lends, exchanges and protects money."
 ,verb,Bank means to pile up or build up.
based,suffix,Based is used with a location and is defined to show where something is situated.
based,suffix,The definition of based means having something as its major element.
bauble,noun,The definition of a bauble is a showy ornament or decoration of little value.
be,verb,The definition of be is to exist or to exist as an example of something.
before,adverb,"The definition of before is something that happened before another thing, or something that was in front of or before another."
,preposition,Before is defined as a previous time.
beg,verb,"The definition of beg means to plead for something, especially for money or assistance."
beginning,adjective,The definition of beginning is something that is in the early stages or the first portion of something.
,noun,Beginning means the moment or place when something started.
behaviour,noun,The definition of behaviour is the British spelling for the way a person or thing acts.
believe,verb,The definition of believe means to have confidence in the truth of something.
best,adjective,The definition of best is better than all others.
,adverb,Best means in the greatest advantage or manner.
,noun,Best is defined as the greatest degree or highest efforts.
bestial,adjective,"The definition of bestial is savage, or like a beast or wild animal."
better,adjective,The definition of better is superior or of high quality.
,adverb,"Better means to a greater degree, or more appropriate."
,noun,"Better is defined as the person in authority, or the thing that is more preferable."
,verb,Better is to make something more acceptable.
between,adverb,The definition of between is the space between two points in position or time.
bevy,noun,"The definition of a bevy is a group, especially a group of young women or quail."
bewilderment,noun,The definition of bewilderment is a feeling of confusion or lack of understanding.
biannual,adjective,The definition of biannual is something that occurs twice per year.
bicameral,adjective,The definition of bicameral is something with two lawmaking groups.
bigotry,noun,The definition of bigotry is prejudice and the state of being intolerant.
bird,noun,"The definition of a bird is a warm blooded member of the Aves class, which has feathers, a beak, no teeth, wings and bears young in eggs."
bistro,noun,"The definition of bistro is a small Parisian-style restaurant that serves simple meals, wine and coffee in a casual, modest setting."
bittersweet,adjective,"The definition of bittersweet is a combination of both bitter and sweet, or an emotional feeling that is a mixture of both happy and sad."
,noun,"Bittersweet is defined as a climbing plant in the nightshade family or Celastrus genus, or the emotion that joins joy and sadness."
black and white,adjective,The definition of black and white is a TV show or movie made before color film and color TV technology was developed.
black and white,adjective,Black and white is defined as a situation where there is only one clear right answer and where there are no nuances to consider.
,noun,Black and white is a slang expression for a police car.
,noun,Black and white means a television that does not offer a picture in color.
blew,verb,"The definition of blew is the past tense of to blow, meaning you pushed something using air from your mouth or something like wind pushed something forcefully."
blog,noun,"The definition of a blog is an online, chronological commentary."
,verb,To blog is defined as to write on a website that comments on current events or a specific topic.
blowhard,noun,The definition of a blowhard is a person who boasts in an obnoxious or unpleasant way.
bludgeon,noun,The definition of a bludgeon is a thick heavy club typically used as a weapon.
,verb,"Bludgeon is defined as to use force or bullying to get someone to do what you want, or to beat someone repeatedly with a heavy object or stick."
boarder,noun,"The definition of a boarder is a person who pays for room and meals at someone's home, or a person who gets on a plane or boat."
book,noun,The definition of book is a story or collection of stories that can be read.
,verb,To book is defined as to make reservations for something in advance.
bought,verb,The definition of bought means purchased.
bower,noun,"The definition of a bower is an area shaded by trees or other plants, a woman's private dressing room or a country cottage."
brand-new,adjective,The definition of brand-new is something that has never before been done or that has never been used before.
brawn,noun,"The definition of brawn means developed muscles, or physical strength."
break,noun,"The definition of a break is a period of separation or a split, gap or fracture."
,verb,"Break means to smash, split or fracture or to not abide by rules or laws."
break-in,noun,"The definition of a break in is an illegal entry into a house, building or vehicle."
break-in,noun,A break in is defined as the first usage or experience with something.
breakwater,noun,The definition of a breakwater is a barrier built in a body of water to break the force of waves and protect surrounding land.
bring,verb,The definition of bring means to carry or to cause to happen.
brought,verb,The definition of brought means something happened as a result of another action.
brought,verb,Brought means you carried someone or something to a place.
Buddhism,noun,"The definition of Buddhism is a religion and teachings of the Buddha, founded in India in the sixth century."
budgetary,adjective,The definition of budgetary is something related to a budget (the amount of money available or a financial plan for spending that money).
building,noun,The definition of a building is a structure or the process of making a structure.
but,adverb,The definition of but is only or merely.
,conjunction,"But means except for, unless or on the contrary."
,preposition,But is defined as with the exception of.
by,adverb,"The definition of by is in the immediate region, or to go past something."
,preposition,"By means near or next to, and it also means through which."
bye,noun,"The definition of bye is something that is not as important, or advancing to the next round in a competition without having to play an opponent."
call,verb,"To call is to make a sound intended to attract a person's attention, or is when an animal makes a special sound to attract other animals, or to use the telephone to contact someone."
cameral,adjective,"The definition of cameral is of the chamber of a judge, legislative member, etc."
candidacy,noun,"The definition of candidacy is the state of running for office, for a position or for an honor."
caring,adjective,The definition of caring is someone or something that shows kindness and concern for others.
carrion,adjective,The definition of carrion is relating to or eating dead or dying flesh.
,noun,Carrion is defined as dead or dying flesh.
carry,verb,"To carry is to transport or support the weight of something or someone, or to assume responsibility for someone or something, or to walk and act in a certain manner."
catapult,noun,The definition of a catapult is a military machine or other device that launches something with great force.
,verb,To catapult is defined as to forcefully throw something.
Catholic,adjective,"The definition of catholic is something that is wide-ranging, comprehensive, or refers to something or someone related to the Christian church or the Roman Catholic Church."
caught,verb,"The definition of caught means taken hold of and prevented from leaving, or spotted in the act of doing something wrong."
caught,verb,Caught is the past tense of catch and means that someone was trapped or something that was thrown was grabbed.
cauterize,verb,"The definition of cauterize is to burn or freeze the flesh around a wound, usually to close off or clean the wound."
Cavalier,adjective,The definition of cavalier is an arrogant person or someone indifferent or casual about important matters.
,noun,A cavalier is defined as a knight or a courteous gentleman.
celibate,adjective,"The definition of celibate is refraining from sexual relations, usually for religious reasons."
Celsius,adjective,The definition of Celsius is something related a system of measuring temperature where water freezes at 0 degrees and boils at 100 degrees.
,noun,Celsius is defined as a system of measuring temperature where water freezes at 0 degrees and boils at 100 degrees.
centre,noun,"The definition of centre is the British spelling for center and means the middle of something, or is a region in central France."
centric,adjective,The definition of centric is something that is centered or near the center.
centurion,noun,The definition of a centurion is a leader of 60 to 100 soldiers in the ancient Roman army.
certainly,adverb,The definition of certainly is absolutely or definitely.
cession,noun,"The definition of cession is the giving up of rights, property or territory to another."
chalice,noun,The definition of a chalice is a cup or goblet.
change,noun,The definition of a change is the act becoming different.
,verb,Change means to replace one thing for another or to become different.
chassis,noun,"The definition of a chassis is the structural framework or base framework of a car, computer, radio, or piece of audio equipment."
cheque,noun,"The definition of cheque is the British spelling of the word ""check"" and refers to a written order directing a bank to pay money."
children,noun,The definition of children means more than one child.
Chinese,adjective,Chinese is defined as something relating to China.
,noun,The definition of Chinese is a person or language from China.
choice,noun,The definition of choice is the act of making a selection or the person or thing which is selected.
chose,verb,The definition of chose is the past form of choose and means to have made a selection.
chosen,adjective,The definition of chosen is a person or thing that has been picked out or decided upon.
Christ,noun,"The definition of Christ is Jesus, the Messiah whose coming was predicted in the Old Testament."
Christian,adjective,The definition of Christian is something related to the teachings of Jesus Christ or related to the practice of following Jesus Christ.
,noun,A Christian is defined as a person who believes in the teachings of Jesus Christ and who has accepted Christ as his/her savior.
Christianity,noun,The definition of Christianity refers to the religion and followers that believe in the teachings of Jesus.
Christmas,noun,"The definition of Christmas is a holiday celebrated on December 25 both as a religious tradition commemorating the birth of Jesus and as a secular holiday.Christmas TraditionsMany people around the world decorate with evergreen trees and branches. Germans started bringing these trees into their homes in the 16th century. Evergreens represent strength, because they can stand up to a harsh, cold winter. In some cultures, they are believed to ward off evil spirits. Besides that, they also smell great. Trees and evergreen wreaths can be decorated with just about anything: popcorn, candles, lights, apples, berries, small toys, cookies, ornaments, tinsel, garland, and nuts.The first printed Christmas cards started in England in 1843 as a way to remind people to help the poor. The very first printed card said, “A Merry Christmas and a Happy New Year to You"" and was sent by Sir Henry Cole. At first, the cards had signs of spring, like birds, animals, children, and fairies. This tradition caught on quickly and is practiced by many around the world.The tradition of hanging stockings by the fire started with the story of St. Nicholas. He wanted to help a poor man and his three daughters, but wanted to be anonymous. As the story goes, he rode by their house on a white horse and tossed three bags of coins down the chimney. The bags were miraculously caught in the girls’ stockings that had been hung there to dry."
city,noun,The definition of a city is a town of significant size or an urban area with self-government.
clamour,noun,"The definition of clamour is an alternate spelling of clamor, which means chaotic or loud noises and demands from many people."
cleanup,adjective,The definition of cleanup is the fourth hitting position in a baseball lineup.
,noun,"Cleanup is defined as the elimination of crime, dirt, junk or anything else that you don't want, or is slang for a large profit."
clothes,noun,The definition of clothes are garments worn on the body for protection or adornment.
cloud,noun,"The definition of a cloud is a visible mass of small water droplets or ice particles which are suspended in the sky.Facts About CloudsWhen a cloud forms in space, it is known as an interstellar cloud, or a nebula. Three components are necessary for clouds to form: water vapor, cool or cold air, and condensation nuclei. A white cloud means that the cloud was formed with warm air. A grey, or a black cloud, means that the cloud contains larger drops of water.There are four main types of clouds:Cumulus - the white and puffy clouds in the sky, generally under 7,000 feet in altitude. Made up almost entirely of water drops.Stratus - the flatter clouds that stretch over greater lengths of distance in the sky, generally under 7,000 feet in altitude. Made up almost entirely of water drops.Cirrus - clouds which are extremely high in the sky, generally over 18,000 feet, and are very thin and feathery looking. Composed primarily of ice crystals.Cumulonimbus - clouds which go the highest of all clouds, up to 60,000 feet. They produce storms, thunder and lightening."
cloud,noun,"Cloud is defined as a mass of smoke, dust, steam or a mass of things suspended in the air."
,verb,"To cloud is defined as to darken, cover or make gloomy."
coed,adjective,The definition of coed is coeducational and is something that is available to both men and women.
,noun,A coed is defined as a female student.
cold,adjective,The definition of cold is a low temperature or is someone who is not warm and friendly.
