word,pos,definition
most,adjective,"The definition of most is the majority or the greatest amount, degree or size."
,adverb,Most is defined as to the highest or greatest level.
,noun,Most means the greatest number of something.
mould,noun,"Mould is the British spelling for mold, which is defined as a container that is used to set something's shape or is a fungus that grows."
mourning,noun,Mourning is a feeling and period of sadness after a loss.
mr,noun,Mr. is defined as a title for a man.
mrs,noun,Mrs. is defined as a title for a married or widowed woman.
ms,noun,Ms. is defined as a title for a woman that does not specify whether or not she is married or widowed.
multiform,adjective,The definition of multiform is having many shapes.
mum,adjective,Mum means not talking.
,interjection,Mum is defined as a way to request that someone stop talking.
,noun,"The definition of a mum is a strong beer, a shorter way of referencing the flower chrysanthemum or a British term for mother."
,verb,Mum is defined as to act as a mime or wear a mask to a festival.
muslim,noun,The definition of a Muslim is a person who follows and practices the beliefs of Islam.
must,noun,The definition of a must is something that has to be done.
,verb,Must is used to express a requirement or a necessity.
mutable,adjective,"The definition of mutable is a person or thing that changes or can be changed, or changes often."
myself,pronoun,Myself means your happy and healthy state.
myself,pronoun,Myself is how you talk about yourself when speaking or writing.
name,noun,"The definition of a name is a word or phrase that labels a person, place or thing."
,verb,"Name is defined as to give a title to a person, place or thing."
nasa,abbreviation,"NASA is defined as an acronym for the National Aeronautics and Space Administration, the federal agency that is responsible for aerospace research, aeronautics, and the civilian space program."
nauseous,adjective,"The definition of nauseous is a feeling of being sick and feeling as if you need to vomit, or something disgusting or sickening."
Nazi,adjective,"Nazi is defined as something that relates to the German fascist political group founded in 1919, supported by Adolf Hitler and abolished in 1945."
,noun,"The definition of a Nazi is a person who belongs to, supports or acts like a member of Hitler's National Socialist German Workers' Party."
near,adjective,"The definition of near is close in distance, time or relationship."
,adverb,Near is defined as at a relatively close distance in space or time.
,verb,Near means to get closer.
need,noun,The definition of a need is a desire or requirement.
,verb,"Need is defined as to want, desire or require."
neighbour,noun,"Neighbour is an alternative spelling of the word neighbor, which is a term used to refer to people who live in your community and who are close to you."
networking,noun,"Networking is defined as the act of making contact and exchanging information with other people, groups and institutions to develop mutually beneficial relationships, or to access and share information between computers."
never,adverb,"Never is defined as absolutely not, or not ever."
new,adjective,The definition of new is coming into being for the first time.
,noun,New is defined as something that has recently come into being.
next,adjective,The definition of next is just before or after.
,adverb,Next is defined as in the space immediately before or after.
,noun,Next means the one immediately following.
nice,adjective,The definition of nice is someone who is pleasant or agreeable or something that is in good condition and that is pleasing.
no,adjective,"The definition of no is not any, not one or hardly any."
,adverb,No means the opposite of yes and is used to express denial or disagreement.
,interjection,No is defined as a way to express disbelief or refusal.
non,interjection,Non is defined as no.
,prefix,Non is defined as not or no.
nonchalance,noun,Nonchalance is a state in which you are unfazed or unaffected.
noncommittal,adjective,The definition of noncommittal is a person or behavior that is vague and that does not reveal a commitment to something or position on something.
not,adverb,Not is defined as a word used with a verb to make a negative.
notate,verb,To notate is to make a note in words or music.
now,adverb,Now is defined as at the present time or immediately.
October,noun,October is the tenth month of the year.
of,preposition,Of is defined as to indicate ownership or distance from something.
off,adjective,"The definition of off is something that is no longer attached, no longer in operation or no longer happening."
,adverb,Off is defined as to keep someone or something away or separate.
,adverb,Off means to be no longer in a functioning position.
,adverb,Off is defined as to be less than.
offence,noun,"Offence is another word for offense, which is a wrongdoing or discourtesy."
officer,noun,"The definition of an officer is a person in a position of authority in a business, the police, the military or other group."
,verb,"Officer is defined as to command over with authority, or provide with authority figures."
often,adverb,The definition of often is many times or frequently.
oh,interjection,"Oh is defined as something said to show surprise, to attract attention, or to show you understand."
OK,adjective,The definition of OK is all right or correctly.
,adverb,Ok means all right or correctly.
,interjection,OK is defined as all right.
,noun,OK is an approval.
,verb,OK is defined as to approve.
old,adjective,The definition of old is advanced in age or having been around for awhile.
,noun,Old is used to mean people advanced in age collectively or days past.
on,adjective,The definition of on is in action or performing a function.
,preposition,On is defined as to show position.
one,noun,"One is a single person, unit or thing or the first number in a counting series."
one-off,noun,The definition of a one-off is something that happens only a single time.
only,adjective,The definition of only is alone or by itself.
,adverb,Only is defined as no other or nothing more.
,conjunction,Only means but or except that.
op,noun,"Op, short for optical art, is a style of art that uses figures to create illusions."
opec,abbreviation,"OPEC is defined as an abbreviation for Organization of Petroleum Exporting Countries, which is a union of oil producing countries that regulate the amount of oil each country is able to produce."
optimize,verb,To optimize is to make something the best it can be.
orifice,noun,"The definition of an orifice is an opening, especially an opening to the body or the opening of a tube or pipe."
other,adjective,The definition of other is the remaining or different one.
our,adjective,The definition of our is belonging or relating to us.
out,adjective,The definition of out is something beyond the set limit or boundary.
out,adjective,Out means someone who is openly gay.
,adverb,"Out is defined as away, in the open, into existence, visible or clearly."
over,preposition,"Over is defined as above, on top of or higher in rank or authority."
paleolithic,adjective,"The period of time that extends from the beginning of human existence, approximately 2.5 million years ago, until around 10,000 years ago, relating to the time humans began to use simple tools made from stone.Also referred to as the Old Stone Age."
pallet,noun,The definition of a pallet is a portable platform used to move or store goods or a tool used by potters to smooth clay.
pants,noun,Pants are trousers or clothing that you wear to cover your legs and bottom.
paper,noun,"Paper is defined as an essay, written report or school exam."
paper,noun,The definition of a paper is a newspaper.
paper,noun,Paper means a thin material made of fiber pulp.
paramour,noun,The definition of a paramour is a lover or romantic partner.
park,noun,"The definition of a park is an area of land used for various purposes such as recreation, playgrounds and swimming."
,verb,"Park is defined as to make into an outdoor recreational area, or store in such a space, or to put a car in a space temporarily."
party,noun,"The definition of a party is a gathering of people to have a good time or celebrate an occasion, or a group who do things together or a group of people who share the same political ideals."
,verb,"To party is to enjoy yourself and have a good time, especially at a social event."
pass,noun,To pass is to successfully complete or finish something.
,verb,To pass is defined as to go by or move through or out of something.
,verb,Pass means to hand something off to someone else or to refrain from doing something.
patronizing,adjective,"The definition of patronizing is pretending to be nice when actually talking down to someone, or treating someone as if he or she is less intelligent."
,verb,Patronizing is defined as the act of a customer going to a store or restaurant.
pay,verb,"To pay is defined as to give someone what is due, usually money, for goods or services."
pc,abbreviation,"Pc is defined as an abbreviation for personal computer, or politically correct or a professional corporation."
peacekeeping,adjective,"The definition of peacekeeping is the behavior of trying to prevent fighting, especially of trying to prevent war between nations."
,noun,Peacekeeping is the process of maintaining peace.
peon,noun,The definition of a peon is an unimportant worker or a drudge who does menial work.
perhaps,adverb,"Perhaps is defined as possibly or maybe, or as a polite way to give advice or make a suggestion."
pert,adjective,"The definition of pert is something that is bold and stylish with a little attitude, or lively and stimulating."
perusal,noun,The definition of a perusal is the examination or reading of something paying attention to details.
pharaoh,noun,The definition of a Pharaoh was the king in ancient Egypt.
phone,noun,"Phone is short for telephone, meaning the instrument used to call others."
,suffix,Phone is defined as a certain type of sound.
,verb,"To phone is short for to telephone, meaning to call someone using a telephone."
picky,adjective,"The definition of picky is fussy, or overly exacting."
picture,noun,"The definition of a picture is a photo, drawing, painting or other image captured of a person, thing or scene."
,verb,Picture is defined as to capture or create an image of a person or object or scene or to visualize something.
pie,noun,"Pie is fruit, meat or cheese prepared with a pastry shell, usually baked with a pastry crust and round, or a layer of cake with a sweet filling."
piece,noun,The definition of a piece is a part of a whole.
,verb,Piece is defined as to put together or to fix.
pilgrimage,noun,"The definition of a pilgrimage is a long journey, especially one made by a person going to a holy place."
pinion,noun,"Pinion is defined as the outer sections of a bird's wings, or is a small gear that engages with a larger gear."
,verb,Pinion is to restrain someone's arms or legs.
place,noun,Place is defined as a particular location or space or the particular area normally occupied by something.
,verb,Place means to put in the proper position or order or to set down.
placement,noun,"Placement is the act of organizing people or things into a certain order, the act of putting items in a certain location, or the act of finding a job for someone."
play,noun,Play means activity for fun or a dramatic performance.
,verb,Play is defined as to engage in activity for fun.
plc,abbreviation,"PLC is an abbreviation of public limited company, a British business term."
plough,noun,"Plough is another word for plow, which is a farm tool with heavy blades that cuts through the soil."
PM,noun,"P.m. is defined as post meridiem in Latin, which means after 12 noon."
podcast,noun,"The definition of a podcast is a multi-media digital file distributed over the Internet to be watched and listened to on a computer, iPod or other device."
,verb,Podcast is to produce a digital multi-media file for distribution over the Internet and for people to listen to on iPods and other portable devices.
portly,adjective,"The definition of portly is someone who is stout or has a large, heavy body."
poultice,noun,"The definition of a poultice is a medical dressing or is a soft, moist mass of natural materials that you put on your body and keep in place with a cloth to try to reduce soreness or inflammation."
practise,verb,"Practise is a British variation of the word practice, which is defined as to rehearse or to do something multiple times to try to get better at it."
preview,noun,The definition of a preview is a show of something before it is finally released.
,verb,To preview is to see or hear something before it is finalized.
prim,adjective,"The definition of prim is a proper, precise and formal person."
prioritize,verb,To prioritize is to organize or complete things in order of their importance.
privy,adjective,Privy means something hidden.
,noun,The definition of a privy is a toilet.
proactive,adjective,The definition of proactive is someone who takes an active role in dealing with something before it needs to be taken care of.
programme,noun,"Programme is a British spelling for a program, which is a planned series of events, or a performance, or a booklet telling you what events to expect as part of a series of events."
,verb,"Programme is a British spelling for program, which is defined as to input data into a machine to cause it to do a certain thing, or to train a person or animal to behave or react in a certain way."
prosecutor,noun,"The definition of a prosecutor is a lawyer who represents the people and who works for some type of government body, such as a District Attorney's office."
prosody,noun,Prosody is the study of the style and structure of poetry.
protestant,adjective,Protestant is defined as something related to a western Christian religion that follows the principles of the Reformation and that has broken with the Roman Catholic Church.
,noun,"The definition of a Protestant is a member of a Western Christian religion that follows the principles of the Reformation and that has broken with the Roman Catholic Church, or a person who protests."
proverbial,adjective,The definition of proverbial is something well-known or commonly referred to.
proviso,noun,The definition of a proviso is a condition attached to an agreement.
proximate,adjective,The definition of proximate is the next or nearest person or thing.
publishing,noun,"Publishing is the job of editing, creating and marketing of written and recorded material and software."
Pueblo,noun,"The definition of a pueblo is an communal village of Latin Americans, Southwest US Indians or Spanish Americans."
pummel,verb,Pummel is defined as to hit over and over again.
punk,noun,"Punk is defined as a young, rebellious person, or aggressive rock music that was popular in the 1970's and those who admire that style of music."
purgatory,noun,Purgatory is a place or state of being where people exist temporarily to admit their sins or receive punishment.
purposeful,adjective,"The definition of purposeful is having a use, or showing determination to achieve a specific aim."
purse,noun,"The definition of a purse is a small bag or pouch to carry money, or a sum of prize money."
,verb,"Purse is defined as to gather into small folds, or to pucker the lips tightly together."
put,verb,Put is defined as to place something or cause something to happen.
put-down,noun,Put-down is slang for an insult or a negative statement about someone or something.
question,noun,The definition of a question is the asking of something.
,verb,Question is defined as to ask something or to doubt something.
quorum,noun,The definition of a quorum is the minimum number of people needed at a meeting to conduct business.
rain,noun,Rain is condensed moisture from the atmosphere that drops on the Earth as water.
ran,verb,"Ran is defined as to have moved by quickly moving the legs, or to have gone on a quick trip, or to have been in charge of something."
read,verb,The definition of read is to use eyes or fingers to figure out what letters or other symbols mean.
read,verb,"Read is defined as interpret what a person is saying by looking at their lips, understand as if by reading, or to predict."
recurring,adjective,"The definition of recurring is happening time and again, or returning."
red,adjective,The definition of red is having the color on the end of the spectrum before orange.
,noun,Red is the color on the end of the spectrum before orange.
reek,verb,"To reek is to smell strongly of something unpleasant, or to give off a sense of something unpleasant."
rehabilitation,noun,Rehabilitation is defined as bringing back to a positive condition.
related,adjective,The definition of related is being associated with.
reporter,noun,The definition of a reporter is a person who gathers information and writes about it.
reschedule,verb,Reschedule is defined as to change the date or time of something.
retarded,adjective,"The definition of retarded is delayed, or is a politically incorrect term for someone who has a mental handicap."
return,verb,"To return is defined as to go back to someone or something, or to put something back."
revengeful,adjective,The definition of revengeful is someone who wants to get even.
rewind,verb,"To rewind is to reel or wind a tape or film backwards, or to otherwise reverse back on something."
rich,adjective,"The definition of rich means having great value, worth or material wealth, or money, or containing ingredients to give something a heavy, deep flavor."
,noun,The rich is defined as the group of people who are wealthy.
right,adverb,"Right means correctly, completely, thoroughly or exactly."
,noun,"Right is defined as something is the correct, proper or moral choice or something that is true or correct."
,verb,To right is defined as to put back into the proper upright position.
rise,verb,"Rise is defined as to wake up, stand up, go to a higher place or increase in amount."
risen,verb,"Risen is something that has stood up, increased or gone to a higher place."
river,noun,The definition of a river is a natural stream of water that empties into another body of water.
road,adjective,"The definition of road, in sports, is being played on another team's home field."
,noun,"Road is defined as a path, course or space for traveling between places."
rode,noun,The definition of a rode is the rope or chain attached to the anchor used with a small boat.
,verb,Rode is defined as to have taken a ride.
ROM,noun,The definition of an rom is a male Gypsy.
ROM,noun,"ROM stands for Read Only Memory, a type of computer memory."
Roman,adjective,The definition of Roman is relating to Rome or the Roman Catholic church.
,noun,"Roman is defined as a person from Rome, a member of the Roman Catholic Church, the language spoken in Rome, or a narrative poem or novel in medieval French writings."
run-up,noun,"The definition of a run up is a sudden increase, particularly in terms of price."
runner-up,noun,The definition of a runner up is a person who finishes second in a race or other competition.
sadistic,adjective,The definition of sadistic is deriving pleasure from humiliating or causing physical or psychological pain to others.
said,adjective,The definition of said is the previously mentioned item in legal speak.
,verb,Said is defined as expressed something in words.
same,adjective,The definition of same is a person or thing which is equal or identical to another.
SAT,abbreviation,"The SAT is defined as the Scholastic Assessment Test, now called the SAT Reasoning Test, which is a test that measures the reading, writing and math levels of high school juniors and seniors."
,verb,Sat is defined as to have sit down or have been seated.
satisfied,adjective,Satisfied is defined as contented or fulfilled.
Saturn,noun,"Saturn is defined as a planet in our solar system which is know for its rings.Facts About SaturnSaturn was named after a Roman god, Saturnus, who was the god of agriculture.In 1610 Galileo was the first person to see Saturn through a telescope. Its shape puzzled him, because it didn’t look spherical, but looked more like an oval. In 1655, Christiaan Huygens had a better telescope and could see the rings more clearly. Two decades later, Giovanni Cassini made the discovery that the rings were not solid, but made up of particles. He also saw that there was more than one ring, and there was a large gap, 2980 miles wide, between two of them. The gap was called the Cassini Division, named in his honor.Saturn is the sixth planet from the Sun, approximately 888 million miles away from the Sun.Saturn has a diameter of about 75,000 miles as compared to the 8,000 mile diameter of the Earth.One orbital period lasts for over 29 years. That means, in Earth time, that one year here is equivalent to over 29 on Saturn.The exact length of a year is 29.42 Earth years.One day on Saturn lasts for 10 hours and 39.4 minutes.Its atmosphere is 97% hydrogen, 2.5% helium, and .5% methane; but, it is believed to have a solid inner core of iron and rocky material.Saturn is the windiest planet, with winds blowing at 1,100 miles per hour.Saturn has a very strong magnetic field.Saturn has 62 moons, with the largest of Saturn’s moons as big or bigger than the Earth’s moon. Many of Saturn’s smaller moons are no larger than comets. Half of the moons orbit Saturn in the same direction as the planet itself.Its most distinctive feature is its seven rings of varying lengths, widths and densities. The rings consist of rocks, ice and space debris.The first probe to fly by Saturn was the unmanned spacecraft Pioneer 11 in 1979. It was exploring the outer planets and discovered two new moons and charted the magnetosphere.Voyager 1 and Voyager 2 flew by Saturn as part of their mission. They both measured the length of a day on Saturn as 10 hours, 39 minutes, and 24 seconds. The Voyager spacecrafts identified 6 more moons on their mission, bringing the total to 17.The Cassini-Huyggens spacecraft was launched in 1997 as a joint effort between the National Aeronautics and Space Administration (NASA), European Space Agency (ESA), and Italian Space Agency (ASI) to study Saturn and two of its moons. It reached Saturn in 2004 and captured photographs. The probe went on to study Titan, one of Saturn’s moons. In 2008, NASA extended the mission and renamed it the Cassini Equinox Mission. In 2010 the mission was called the Cassini Solstice Mission and will continue through 2017."
say,adverb,Say means approximately or for example.
,noun,The definition of a say is the right to speak or choose.
,verb,Say is defined as to speak or express in words.
saying,noun,"The definition of a saying is something that has been said, like a motto or catch phrase."
,verb,Saying means telling.
sceptic,noun,Sceptic is another spelling for skeptic which is a person who questions accepted beliefs.
sceptical,adjective,"The definition of sceptical, also spelled skeptical, means someone who is questioning or having doubts."
Scotch,adjective,The definition of scotch is to be from Scotland or something related to the Scottish language or culture.
,noun,Scotch is a whisky distilled from malted barley in Scotland.
,verb,"Scotch is defined as to cut, wound or put an end to."
sea,noun,Sea is the salt water covering the Earth or a large body of salt water which is partially enclosed by land.
season,noun,"The definition of a season is one of the four division in a calendar year, the best time to do something or when something typically happens."
,verb,To season is defined as to add herbs and spices to make food more tasty.
sedition,noun,Sedition is defined as words or speech that incite people to rebel against the government or governing authority.
see,verb,To see is to use your eyes to look at things or that something is visible to you.
segmental,adjective,The definition of segmental is divided into pieces or relating to the pieces.
self-aggrandizement,noun,Self aggrandizement is defined as exaggerating one's own importance or power.
sell,verb,"Sell is defined as to exchange something for money, act as a sales clerk or offer for sale."
sepulcher,noun,"The definition of a sepulcher is a small room, usually made of stone, where a dead person is buried."
,verb,Sepulcher is to serve as a place to lay or bury something.
serve,verb,To serve is to give someone service or present someone with something.
shambles,noun,The definition of a shambles is a state or condition of complete disorder.
she,pronoun,She is defined as a female who was previously mentioned.
sherbet,noun,"Sherbet is a frozen dessert made with fruit juice, sugar and water with a small amount of dairy, egg white or gelatin."
shingle,noun,"Shingle is a coarse, large-sized gravel, or a piece of wood, metal, etc. used as a covering for a house or roof."
shone,verb,"Shone is the past tense of shine and is defined as something reflected light, a surface was polished or someone stood out because of excellence."
shook,noun,Shook are the parts needed for making a barrel or a packing box.
,verb,"Shook is defined as someone or something has been moved in short, quick motions."
short,adjective,"The definition of short is something that is not long, that measures a minimal distance from one end to the other, or that does not last for a long time."
show,adjective,Show describes something related to a performance.
,noun,"The definition of a show is a demonstration, display, or performance."
,verb,"Show is defined as to bring into view, teach, or display."
shown,verb,Shown is defined as you have displayed or proven something.
